text,person,random
"For 9 million women and children, the #TeaPartyShutdown means nutritional assistance is in jeopardy.pic.twitter.com/zqr33u9YYz",obama,0.5623694131030197
This happened because of you. Thank you.,obama,0.8266173354796061
"""A mom should not have to go bankrupt if her son or daughter gets sick ... I think most Americans agree with that"" ?President Obama #CGI2013",obama,0.6971590350101582
"""Democracy grinds to a halt without a willingness to compromise."" ?President Obama #SOTU",obama,0.8416449776455147
It's time to get serious and #ActOnClimate.pic.twitter.com/VqELsMFhe9,obama,0.8328868814285859
How do you think the President?s jobs plan will help you? Share your story: http://OFA.BO/dvDBkC?,obama,0.6105405269774232
President Obama is hitting the road this summer to meet Americans who wrote him a letter. Read more:http://ofa.bo/e09g?,obama,0.607873587429375
"""In 2014, our economy created 3.1 million jobs?and that's the best year of job growth since the 1990s."" ?President Obama",obama,0.693125975260152
No more games?Congress should stop the political posturing and make progress on immigration. #EnoughAlreadypic.twitter.com/LH2npSuNR4,obama,0.6928155692754844
Retweet if you are proud that immigration is a part of our nation's heritage.pic.twitter.com/ipHHyrRDkH,obama,0.6359990015095952
"""The American people have to demand that the folks in Washington do their job."" ?President Obama #RebuildAmerica",obama,0.8434692210529997
"This woman saved money, thanks to @Obamacare, and the law helped her family #GetCovered. Read more from Fox News:http://OFA.BO/8KZbt8?",obama,0.7526121422636969
"FACT: America?s dependence on foreign oil has reached a 20-year low, down 25% since President Obama took office. #progress",obama,0.5767591326054885
"""We celebrate the ADA's lasting legacy as a pillar of civil rights."" ?President Obama on the anniversary of Americans with Disabilities Act",obama,0.5308720407379891
"""You're able to get free preventive care, including mammograms, as a consequence of this law."" ?President Obama",obama,0.7380911838452807
It's time for our representatives to act on comprehensive immigration reform. #TakeItToTheHousepic.twitter.com/qgmnrctweR,obama,0.7947972403441944
ICYMI: The unemployment rate is now at a seven-year low.http://ofa.bo/t9Qf?,obama,0.6791806257079731
RT if you agree that 7 million students who rely on Stafford loans to finance their education shouldn?t face higher debt. #DontDoubleMyRate,obama,0.8275641715543078
"For Holly, the relief of knowing she's covered is priceless: http://ofa.bo/q5K? #ThisIsWhypic.twitter.com/mMi79rkMQO",obama,0.9492156319531186
"""You guys give me confidence. You guys give me hope. I really need all of you to get out and vote on Nov 2."" http://bit.ly/bMemJl",obama,0.7209184229526638
"""Every day we wait to do something about it, even more are stolen from our lives by a bullet from a gun."" ?President Obama #DemandAction",obama,0.5622626792392905
"""When the playing field is level, nobody beats the United States of America."" ?President Obama #LeadOnTrade",obama,0.9570744584376782
High five.pic.twitter.com/yfQHYy02,obama,0.5778171967999829
President Obama gives a fifth-grader the best absence note ever:http://OFA.BO/9iR8Pi?,obama,0.5177911463202337
One-term president? It's up to you: http://OFA.BO/UT1t26?,obama,0.5363165382061129
Retweet if you agree that it's time for the House of Representatives to pass comprehensive #immigration reform. #ActOnReform,obama,0.7952795636904406
"Dinner and some hoops with President Obama and a few basketball legends. Enter now: http://OFA.BO/d84YuX?,pic.twitter.com/eJc6KJJe",obama,0.6142753121480394
"Fired up, ready to go:http://OFA.BO/uM1vp9?",obama,0.7542764014214319
"Four years after Barack Obama first accepted a nomination for president, a look back at promises kept.http://OFA.BO/Fmoj3H?",obama,0.9264751767526388
"""Many women can't even get a paid day off to give birth. You'd think that would be a pretty low bar."" ?President Obama #FamiliesSucceed",obama,0.6182832577233687
Looking forward to signing the repeal of #DADT into law this morning. Watch live at 9:15am ET: http://wh.gov/live.,obama,0.6088086889783254
"For millions of previously uninsured Americans, affordable health insurance is finally in reach.pic.twitter.com/Hy3g0Uhpxs",obama,0.9782396028307884
"""I'd like to see them supporting a family making less than $15,000 a year."" ?President Obama to those who question raising the minimum wage",obama,0.9751821688462126
"Almost half of President Obama's confirmed judicial nominees are women, the highest percentage ever.",obama,0.5572237340131806
"""We've got to give every woman the opportunity she deserves."" ?President Obama #StandWithWomen #OpportunityForAll",obama,0.67344034399807
"""Football is in the air. And I love baseball, but SportsCenter is better when you?ve also got some football on there."" ?President Obama",obama,0.9104943453595832
Join all of us at #Obama2012 in wishing @VP Biden a happy birthday today:http://OFA.BO/2xh9c8?,obama,0.5243537433852843
"RT this if you?re registered and ready to vote so your friends will be ready, too:http://OFA.BO/sPBNKX?",obama,0.92815706122535
"This is wrong: In 24 states, leaders are blocking Medicaid expansion for millions of Americans. http://ofa.bo/giq? #PeopleOverPolitics",obama,0.7474631862560488
97% of scientists agree #climate change is happening. Watch @OFA's new video calling out deniers in Congress: http://OFA.BO/uZJwq1?,obama,0.9280083084089285
It's time for a final vote. Please join with me to help take health reform across the finish line: http://j.mp/9MlVE9,obama,0.5265405452470939
"By a margin of nearly 2-to-1, Americans believe the Senate should hold hearings on a #SCOTUS nominee:http://ofa.bo/d5mM?",obama,0.9127911169906762
"""'If you can imagine it, then you can do it' ... That's a pretty good motto for America."" ?President Obama #NationOfMakers",obama,0.8685375971769219
"So, this happened: http://ofa.bo/j2qN? #CanILive",obama,0.6905685538661789
"Delray, Florida comes out to meet President Obama:pic.twitter.com/FrldqzS4",obama,0.9224290245782542
Some representatives in the House say they'll shut down the government unless #Obamacare is defunded. #EnoughAlready:http://OFA.BO/Y3iazR?,obama,0.9380318294411988
"Between 2008 and 2011, U.S. electricity production from both solar and wind power more than doubled. #MadeInAmerica",obama,0.870307282795756
#WhatHasObamaCareDoneForMeLately? More than 71 million Americans now have access to free screenings for mental health problems.,obama,0.9077029766789876
WATCH: President Obama discusses the need to encourage the education of girls around the globe. http://ofa.bo/f3TE? #LetGirlsLearn,obama,0.9977968223166502
"Mitt Romney promised to cut taxes as governor. Then he imposed over 1,000 fee hikes on MA's middle class:http://OFA.BO/YWPvXN?",obama,0.9269311558500061
President Obama signs the payroll tax cut into law: http://OFA.BO/1XnBor?,obama,0.954530128483048
"""Michelle and I send our deepest thoughts and prayers to the families of the victims in the wake of this senseless loss."" ?President Obama",obama,0.611583691722315
Retweet if you agree. #DoYourJobpic.twitter.com/WjTM07LRL4,obama,0.911070938341936
"""As long as we?re joined in common purpose, as long as we maintain our common resolve...""",obama,0.760886535137694
"""Let?s do the right thing for them, and for this country we love so much."" ?President Obama",obama,0.7053307071830626
"""The events of September 11, 2001, left a permanent mark on the spirit of every American."" ?President Obamapic.twitter.com/oob3Hc0vmi",obama,0.9888462447777382
"""This law is just one step in the broader effort to strengthen our economy and broaden opportunity for everybody."" ?President Obama",obama,0.5848705048804785
Show President Obama you?re with him in making sure all Americans have a fair shot at success:http://OFA.BO/pv3xuM?,obama,0.7341479677447819
Judge Garland has now waited 146 days. That's shameful?and irresponsible. #DoYourJobpic.twitter.com/JaP7YUQyOV,obama,0.5044899776182753
"""No one in America should ever be afraid to walk down the street holding the hands of the person they love."" http://OFA.BO/tM8ybc?",obama,0.5414179806655935
The crowd in Columbus:pic.twitter.com/i5NTIKys,obama,0.5511242469404207
Tell your legislators that construction workers and millions of other Americans can't wait for action on jobs: http://OFA.BO/SQv4oo?,obama,0.5142581442086169
President Obama?s health care law cuts waste and strengthens Medicare?Romney?s repeal plan would bankrupt it by 2016: http://OFA.BO/8fQCHG?,obama,0.9311580363494024
OFA supporters are donating their Twitter pictures to mark the anniversary of the #RecoveryAct. Change yours here: http://bit.ly/b-E,obama,0.773835548628377
President Obama runs into a group of schoolchildren while walking near the White House. WARNING: cuteness ensues.http://ofa.bo/c4XB?,obama,0.7146954416453116
Happening now: President Obama is delivering a statement. Tune in: http://ofa.bo/c0e6?,obama,0.6701557270079855
?I can?t tell you who I?m voting for?it?s a secret ballot. But Michelle said she voted for me.??President Obama,obama,0.5036761406560017
We are headed in the right direction. The last thing we should do is go back to the ideas that got us into this mess. http://j.mp/aMJEcs,obama,0.9067927594752624
"""Food Stamp recipients didn?t cause the financial crisis; recklessness on Wall Street did."" ?President Obama #SOTU",obama,0.7832895533282286
RT @TruthTeam2012: A map of the offshore tax havens where Romney invests his millions: http://OFA.BO/yBFxcA?,obama,0.7008521438361941
"Ten weeks until the election. RT if you?re registered and excited to vote! If you?re not, register here: http://OFA.BO/4TNfUd?",obama,0.8499855676982621
"Before the ball drops, make sure you chip in to help fight for change in 2015: http://ofa.bo/e26Z?",obama,0.6832106199724575
Photo of the day: Rep. Gabby Giffords returned to Congress yesterday for her first vote since January.http://OFA.BO/6m6mrM?,obama,0.550460780610537
Americans have a choice to make this fall?see how your family would fare under the Romney tax plan: http://OFA.BO/34aURS?,obama,0.7529108168281428
"""By all pulling together however we can, we're supporting progress."" Why Dave is part of #Obama2012:http://OFA.BO/VBEfsp?",obama,0.7957217065606601
Take it from @ActuallyNPH: The choice in this election is too important not to vote.http://OFA.BO/fFas8r?,obama,0.7337044625331536
"""Go Team USA."" ?President Obama #USMNTpic.twitter.com/diNCsSvQ3T",obama,0.645980101481647
Sending warmest wishes to all who are celebrating Hanukkah around the world.,obama,0.7605711409391787
"In America, helping those who have fallen on tough times isn't a tough call. http://ofa.bo/fa? #RenewUI",obama,0.904121994924639
Thinking we can cut oil consumption by 2.5 million barrels of oil per day and take 50 million cars? worth of pollution off the road by 2020,obama,0.5869029526177764
"""No one should face violence or discrimination?no matter who they are or whom they love."" ?President Obama #IDAHOT",obama,0.8499384294541796
"In Reading & Scranton, PA today. Honored to be campaigning with Senator Bob Casey and Caroline Kennedy. Visit http://PA.BarackObama.com.",obama,0.9154248440686156
Shadowy conservative groups have pledged $1 billion to take down the President. Help fight back: http://OFA.BO/kUnFUx?,obama,0.6703765451551902
"""I've got a mandate to help middle-class families and families that are working hard to get into the middle class."" ?President Obama",obama,0.8582490094249655
"FACT: Romney would eliminate U.S. taxes on companies? foreign profits, which could create 800,000 jobs in other countries including China.",obama,0.8478857420921931
Had a great three days in Florida.  Watch videos from Florida as well as our amazing stops in OR & IA at http://www.youtube.com/barackobama,obama,0.5932759692910012
"If you?re a student who supports the President, follow @Students4Obama for the latest on what?s at stake for you this fall.",obama,0.8519475211608092
"""From my family to yours, have a safe and happy Fourth of July."" ?President Obamahttp://ofa.bo/p8s0?",obama,0.8100337639547482
"Women make up nearly half of the workforce, but on average make only 77 cents to the dollar of a man. #FairFutureNow",obama,0.8106127260612757
Communities are already experiencing the effects of climate change?we can't afford not to act. Take a look: http://ofa.bo/2d1OQbb?pic.twitter.com/3BFbRDUXBv,obama,0.5757053338148298
Show your support for #Obama2012 with our new t-shirt: http://OFA.BO/cAWncv?,obama,0.7553855582607549
"Today we honor the legacy and ideals of Dr. Martin Luther King, Jr. Watch Sunday's remarks in DC: http://bit.ly/8-e #MLK",obama,0.6007771153902763
Students should be able to get an education without taking on decades' worth of student loan debt. #SOTUpic.twitter.com/taytxY39tM,obama,0.5604455197419436
"Have kids? Pediatric care, including vision and dental, must now be covered by your insurance under the Affordable Care Act.",obama,0.7376928038227475
"""African Americans and Latinos make up 30 percent of our population. They make up 60 percent of our inmates."" ?President Obama",obama,0.8078180465754953
"Tonight's their night, but our focus is tomorrow. Support the President before Friday's critical fundraising deadline: http://OFA.BO/rXfFXE?",obama,0.6540987868827925
Virginian women for Obama:pic.twitter.com/h2Yr0fm0,obama,0.7212419512354507
FACT: President Obama's plan extends tax cuts for 98% of Americans?saving the typical family of four #2200dollars next year.,obama,0.6990555415296544
Most Americans agree: It's time to raise the minimum wage.http://OFA.BO/wJMEqu?,obama,0.7839616468499171
Just two guys hanging out backstage:pic.twitter.com/PP6ZgaF2,obama,0.7308529838182889
"This week, we made sure that 98% of Americans & 97% of small businesses won't see their income taxes go up by one dime.http://OFA.BO/Mxx4f7?",obama,0.5953777582410864
"For many Americans, the Affordable Care Act means getting health insurance for the first time. Listen up: http://ofa.bo/te? h/t @NPR",obama,0.9556070547272992
"""This Memorial weekend, I hope you?ll join me in acts of remembrance."" ?President Obamahttp://ofa.bo/yY1?",obama,0.9782420066898462
?Congress needs to act right now to prevent interest rates on federal students loans from shooting up and shaking you down.??President Obama,obama,0.7206094014108245
"""I try every day to be for Michelle and my girls what my father was not for my mother and me."" ?President Obamahttp://OFA.BO/AXiZca?",obama,0.5128925523194683
Use this tax calculator to find out which candidate is fighting for the middle class: http://OFA.BO/Znv69Q?,obama,0.60006315021659
"""If this country is about anything, it?s about passing on greater opportunity to the next generation.""?President Obama to @NatUrbanLeague",obama,0.80228647297877
Good news: Congress just passed legislation to prevent a student loan rate hike. http://OFA.BO/G4mpE9? #DontDoubleMyRate,obama,0.5953368275066097
Watch live: President Obama speaks on immigration. http://www.wh.gov/live?,obama,0.9648626085116859
"""Today, we gather once more to honor patriots who have rendered the highest service any American can offer this nation."" ?President Obama",obama,0.6617830674245442
Watch this video about the Earth's climate changing at an unprecedented rate: http://ofa.bo/f0zj? #ActOnClimate,obama,0.5275949563696121
"Small businesses help drive America?s economic growth and create new jobs. When our small businesses do well, then America does well.",obama,0.7803600254568738
"Obama: ""The American people have worked too hard, for too long, rebuilding from one crisis to see their elected officials cause another.""",obama,0.5516717124722912
"""I want to make it clear to the American people that we can still bring about meaningful changes that reduce gun violence."" ?President Obama",obama,0.5687095502250623
Happy Easter.pic.twitter.com/Jc9YXXFsv8,obama,0.554300735829968
"Fort Pierce, Florida: becoming famous for good hugs.pic.twitter.com/vwqtfvd5",obama,0.8685474202443646
"With this Supreme Court decision, we're facing no less than a potential corporate takeover of our elections. Watch: http://bit.ly/9iaoHT",obama,0.8813556054150391
"If you're on the Eastern seaboard, please make sure to follow the instructions of your state and local officials today. Stay safe. -bo",obama,0.6560752967990617
"""The best days for this country we love are still ahead."" ?President Obama #ABetterBargain",obama,0.8585820533298575
Small Business Jobs Act will cut taxes and make more loans available for small business. It?s a great victory for America?s entrepreneurs.,obama,0.7391044539037758
"""From my family to yours, Eid Mubarak!"" ?President Obama",obama,0.5236099574966457
L'shana tova to everyone celebrating tonight. -bo,obama,0.8956713190122102
RT if you?re ready to cheer on President Obama in tonight?s debate. #StrongerWithObamapic.twitter.com/YjiAKou8,obama,0.9227701070029268
"Supreme Court seats: 9
Current number of Justices: 8
Number of hearings/votes on President Obama's nominee: 0http://ofa.bo/2aPJMW1?",obama,0.865783454352116
"President Obama: Those who marched sought ""not just the absence of oppression, but the presence of economic opportunity."" #MLKDream50",obama,0.8660661684876106
Send President Obama some love for his birthday: http://ofa.bo/f0Pf?,obama,0.6928909719491043
"""We can?t allow financial institutions, including those that take your deposits, to take risks that threaten the whole economy."" #SOTU",obama,0.9668988560087894
"Former Ohio Governor @Ted_Strickland took the #LiveTheWage Challenge: ""I Tried to Live on Minimum Wage for a Week""http://ofa.bo/r0OU?",obama,0.7859953737174025
"""The unemployment rate is at its lowest since September 2008."" ?President Obama #ReadyToWork",obama,0.8776922664159178
Go green this Earth Day with an Environmentalists for Obama t-shirt: http://OFA.BO/mBiGE6? #EarthDay2012,obama,0.5243633525799779
Best of luck to the U.S. soccer team?you?re representing all of us at the World Cup. We're incredibly proud of what you?ve done already.,obama,0.62543654833733
You can fight back against the polluters and special interest groups. Here's how: http://ofa.bo/jl9? #ActOnClimate,obama,0.500327042644602
President Obama speaks on why Congress should pass the American Jobs Act. Watch live: http://wh.gov/live?,obama,0.8767984803156766
"Today, Irish-Americans celebrate the tremendous influence that one small island with big-hearted people has had on our country.",obama,0.9549932026675388
The story behind a famous photograph:http://OFA.BO/Ff1iLX?,obama,0.5831726779320696
President Obama has appointed more than 250 openly LGBT professionals to his administration?more than all previous U.S. presidents combined.,obama,0.7585026007746055
Yesterday?s election shows discontent with the pace of change?a frustration I share.  We must move forward and keep working together.,obama,0.5079813399197045
"""Are they really willing to hurt people just to score political points? I hope not."" ?President Obama http://OFA.BO/ryKKW3? #EnoughAlready",obama,0.6259907093522982
Retweet if you agree: Women shouldn't have to pay more for their insurance just because they're women. #Obamacare,obama,0.8018775525199457
Check out the most recent editorial boards calling on Senate leaders to vote on Judge Garland: http://ofa.bo/2dNKl4h? #DoYourJob,obama,0.8463696991037027
New CBO report shows #sequester will cost U.S. economy up to 1.6 million jobs by January 2015 unless Congress acts: http://OFA.BO/rCMWrG?,obama,0.5863106275422661
"In his weekly address, President Obama honors the brave men and women in uniform who gave their lives for America.http://ofa.bo/rir?",obama,0.9705116614774592
"Obama: ""I'm not going to stand by while a minority in the Senate puts party ideology ahead of the people we were elected to serve.""",obama,0.8112827343161856
"If you?re looking for the President?s birth certificate, these will come in handy: http://OFA.BO/mwhQKR?",obama,0.8086719657504626
"Only 38 days left in this campaign. Pitch in $5 or more now, when it matters most, to help this campaign win: http://OFA.BO/GvH6hg?",obama,0.5973402256976705
"""Mass incarceration makes our country worse off?and we need to do something about it."" ?President Obama",obama,0.7173804331426782
Fired up in Ohio:pic.twitter.com/FA5BvNHh,obama,0.9242208441258
"Joe Biden has officially been sworn in for a second term. Congratulations, Mr. Vice President.",obama,0.7687458688672378
"""We cannot price the middle class out of a college education."" ?President Obama #MakeCollegeAffordable",obama,0.9006326205745354
"""If you meet the criteria, you can come out of the shadows and get right with the law."" ?President Obama #ImmigrationAction",obama,0.8103244741376812
"""When all Americans are treated as equal, no matter who they are or whom they love, we are all more free."" ?President Obama #LoveIsLove",obama,0.5262856778011717
"President Obama discusses steps he's taking to encourage success for products stamped ""Made in America"":http://OFA.BO/sJeJqG?",obama,0.7250884798765646
"Happy 100th birthday, @NatlParkService. Here's to the next 100. #NPS100pic.twitter.com/LGShTB9l4x",obama,0.8381974343019498
POTUS: ?I don?t think a college student in Colorado Springs should have to choose between textbooks or the preventive care she needs.?,obama,0.7729203487519266
"""You're awesome. Live like it."" Thanks for reminding us, @iamkidpresident. #TheKidsNeedToKnowhttp://ofa.bo/gO4?",obama,0.5478451569025866
"In St. Louis, MO.  At a ""Change We Need"" rally.  Watch it live at http://my.BarackObama.com/livestream",obama,0.7548959199605687
"""My entire presidency has been about helping working families."" ?President Obama",obama,0.7482431479917833
Join President Obama in calling on Congress to raise the federal minimum wage for millions of Americans:http://OFA.BO/otFY43?,obama,0.5287019228243732
LIVE: President Obama is speaking about the importance of #EqualPay for women. http://ofa.bo/i9jO? #StandWithWomen,obama,0.6306884286682636
This is what repealing the Affordable Care Act could mean for this cancer patient. #WhatRepealMeanspic.twitter.com/P1rU4HxxKx,obama,0.911795122782702
"In West Lafayette, IN at Purdue University. Holding a summit on 21st century threats.  Watch it at http://my.barackobama.com/livestream",obama,0.935808928713029
"President Obama: ?If you still believe in me like I believe in you, I hope you will stand with me in 2012.?",obama,0.8280498581054879
Immigrants are part of our #AmericanStory?and common-sense #immigration reform is part of our future economic growth:pic.twitter.com/z802TpxDqu,obama,0.7239211612174913
Saying hi in New Hampshire:pic.twitter.com/3xheqh6c,obama,0.8459917621985309
"Thank you, God Bless you, and may He forever bless these United States of America.",obama,0.533262879837196
"""In too many cases our criminal justice system becomes a pipeline from underfunded schools to overcrowded jails."" ?President Obama",obama,0.7451404417515526
"Obama: ""90% of Americans support universal background checks ... How often do 90% of Americans agree on anything?""pic.twitter.com/ioN96V2xUP",obama,0.9593192842528716
"""You know where I stand. You know what I believe. You know that I mean what I say and I say what I mean."" ?President Obama",obama,0.5571120731369902
"""Change doesn't happen by itself. It happens because people get organized."" ?President Obama",obama,0.6583952805199488
Sign this petition if you believe it's time for a higher minimum wage: http://ofa.bo/ajm? #RaiseTheWage,obama,0.6903244609681362
LIVE: President Obama is honoring veterans at Arlington National Cemetery. http://ofa.bo/c5GI? #VeteransDay,obama,0.516944665201896
Asking you to help Get Out the Vote in these last few critical hours of our campaign for change. Visit http://my.barackobama.com/finaldrive,obama,0.7690641583432245
"?I promise to stand up for you, like you have stood up for me?time and time again.? http://OFA.BO/ctD51d?",obama,0.9888929610684284
Watch the weekly address: President Obama wants a strong economy with opportunities for women and working families.http://ofa.bo/s1PO?,obama,0.952343524449496
It's time for Senate leaders to end the obstruction of our Supreme Court. #DoYourJobpic.twitter.com/oKSLU2ADQi,obama,0.7972852158824227
"The agreement ""further reduces the deficit by raising $620 billion in revenue from the wealthiest households.? ?President Obama",obama,0.96879570674669
RT this link so your friends know President Obama's plan to fix our broken immigration system. http://OFA.BO/E4y1QW? #ImmigrationReform,obama,0.7317133580150003
"""If we make investments early in our children, we will reduce the need to incarcerate those kids."" ?President Obama",obama,0.9346281724385276
"It's easy to be cynical, but there's no challenge we can't overcome. #ActOnClimatepic.twitter.com/OeUW6YqvLc",obama,0.9284031887660285
"FACT: The annual average unemployment rate fell 1.2 percent between 2013 and 2014, the largest decline since 1984.",obama,0.9861163178168468
Americans across the country agree that we need bold action in the fight against climate change. #ActOnClimatepic.twitter.com/znuajZ6CmE,obama,0.9782677927978431
President Obama needs you to tell Congress why health care reform can't wait: http://bit.ly/5Ahqi   #obamahealthcare,obama,0.7779096504837744
The Affordable Care Act is working?for millions of Americans.pic.twitter.com/LBNwxvUxkc,obama,0.5179426699933324
"""On this day and every day, we thank you."" ?President Obama #VeteransDaypic.twitter.com/nRcBslDrdh",obama,0.7748303165998051
"We're working on generating 100,000 calls to Congress for reform. You can help?host a call party: http://bit.ly/rvmh6 #hc09",obama,0.9777174859020048
