text,person,random
Just had the best workout ever! My hands are shaking! Does that ever happen to u? Your hands shake!!!,kim,0.5993650964349605
Alright gym time!!! Let's go!,kim,0.789778879088797
Also 10 pieces of Belle Noel jewelry & 10 Kardashian Kollection for Sears clothes!!! So go to KimKardashian.com for details today!,kim,0.7041721718926572
I officially have Bieber Fever!!!  RT  @justinbieber: Look its my girlfriend @kimkardashian  http://tweetphoto.com/20716573,kim,0.5446271565784979
We're on the set of 90210 right now!! http://bit.ly/Kardash90210 Me and @khloekardashian with Annalynne Mccord!,kim,0.8073340066741963
Hahahaha! well u never know. I may need to! RT @BrittGastineau RT @KimKardashian: Wouldn't trade it 4 nothin RT hmmmmmmm reallllyyyyyyy?,kim,0.7317433546869905
HAPPY BIRTHDAY @Ciara I hope u have the best bday! I love you!!!,kim,0.624415595189975
Let's get @KhloeKardashian to 2 Million followers!!!,kim,0.9972967184413116
I'm the most indecisive person on the planet #fact,kim,0.5646403936840952
The oatmeal from Starbucks is kinda delish!!!,kim,0.5643929501176661
Khloe looks so good on Kocktails With Khloe! Kendall looks so pretty too! What a fun show! Watching direct tv channel 266. Tune in!!!!,kim,0.6755783829360715
I lost my passport!!! I'm stuck in costums! OMG OK breathe we are going back 2 the plane 2 check!,kim,0.5821700364996095
Flashback Friday- me at 4 or 5 years old http://instagr.am/p/WVbpGZOS4W/?,kim,0.5612766576519695
You were amazing in Camp Rock2 @ddlovato Love ya! xoxoxo,kim,0.9057982368442138
Just read the story of Kerry Max Cook. He had been on death row for a murder he didn't commit for almost 40 years.,kim,0.9781995676552444
Can't Get Enough: Sheer Turtlenecks https://www.kimkardashianwest.com/style/480-kim-kardashian-sheer-black-turtlenecks??pic.twitter.com/fvuBrLLsbe,kim,0.8678481821295073
I hope you had a good birthday mamma http://instagram.com/p/gYX50JuS7B/?,kim,0.8955708947723794
Ok tailor & stylist on site! They will have to sew my dress on me! DEEP BREATH!,kim,0.548860524118145
What an amazing victory @serenawilliams!!! http://instagr.am/p/PYC1S4uS8b/?,kim,0.54487696629365
OMG I found an old flip cam #memories! @jOYCEBONELLi u would DIE! #NycNights,kim,0.5762004989498394
40 Million on Twitter!!!!!! Wow thank you soooooo much for all the love!!!!,kim,0.9239668108308656
Tweet Dreams,kim,0.7353148089428528
Scott and I on Chat Roulette!! Who wants to join?,kim,0.6317340534710664
Perfect look for spring and summer? http://bit.ly/1ijAqzI11?,kim,0.815493317920897
Heading to South Africa with @KhloeKardashian @GlamSquadBTS @NoellNK1 !!! Can't wait to get there! Hope they have good movies on the plane!,kim,0.7715968439110343
Girl glam power! @JoyceBonelli http://twitpic.com/5ghl8u,kim,0.9495467110394696
Up early! Have a great day everyone! Xoxo,kim,0.8919929180170947
"About to head out to the Dubai Mall, who is there?",kim,0.664617509930187
"Going to bed early...good night, tweet dreams!",kim,0.6562542040952007
Came home early from the fashion festivities to watch the Netflix Amanda Knox doc. Cannot wait to see this! Anyone see it yet? Thoughts?,kim,0.6261520608591091
http://twitpic.com/14g5ni - Sleeping beauty!,kim,0.5117957087738852
Love this old pic of @KendallJenner and @KylieJenner at Christmas! They are the absolute cutest! http://bit.ly/SNTgVx?,kim,0.8706750723327256
Summer dreamin' http://bit.ly/PrTyJY?,kim,0.7692846282682045
http://twitpic.com/yz474 - Look at this lifesize bottle! Its available now at Sephora.com!,kim,0.7309094198103809
Happy Birthday @RyanSeacrest Love you pic.twitter.com/0GRtfXKYxc,kim,0.6531442921316908
RT @GodPosts: REMEMBER: If your problem in life. is as big as a ship. Never forget that your BLESSINGS are as Wide as the OCEAN,kim,0.9444045462163334
@jessmaynard_ Of course not!,kim,0.7826119009678875
Family dinner time,kim,0.7084986730561067
Picking up Kylie from the school bus stop!,kim,0.7970890299551701
Gonna try to live stream. I'm in the car so let's hope this works and do a Twitter chat!,kim,0.8623879283077981
I believe in the power of love,kim,0.5197671556584436
My little Balmain Ballerinapic.twitter.com/FYawV2bVsP,kim,0.5398564712924648
I'm in Paris right now so can't watch with my Fam but gonna live tweet with you guys! #JetLagged,kim,0.9740368035839362
You're the sun in my morning babepic.twitter.com/qqV6OvR5a1,kim,0.7715289458070035
RT @iamdiddy If we keep God number 1 in our lives there's nothin we can't do #Godismyhero & we need to keep him number 1,kim,0.5538075028728978
Khloe just threw Rob and Reggie in the pool at Wet Republic in Vegas! Hahaha,kim,0.5479073777987867
I put my camera down for a few minutes and this is what I find!! LOL http://bit.ly/kOVc4u,kim,0.7181861108062271
Sooo not cute! I am grossed out! RT @Makeupartist24 Yo Kris & Bruce getting their freak on not cute!,kim,0.5089975185580243
"I honestly can't believe I still haven't been to sleep since I woke up at 2am, and now its 2pm. I'm going to bed!",kim,0.6641599276860002
Hi twitter best friends! #NationalBestFriendsDay,kim,0.5785412047646783
"the laser doesn't hurt too bad, I use numbing cream too! It totally works though! I'm Armenian it's a MUST!!",kim,0.5999581642064229
Cheetos and diet coke will sure wake you up for an early call time!,kim,0.5402445989175474
So excited for tonight's magical #KUWTK episode! http://bit.ly/1gIVOsdfe?,kim,0.6206409165604438
Sunday funday http://instagr.am/p/QOg9InOS1M/?,kim,0.7802174483809532
Thanks mate @codysimpson  http://instagr.am/p/KOUFujuSzk/?,kim,0.6850092848566001
"Last nights look- Balmain Couture, Giuseppe Zanotti heels http://instagram.com/p/oVcBjruS9g/?",kim,0.9733580170531296
Bye Bye Australia! So excited to be coming home! I missed you Los Angeles! Taking off! Xo,kim,0.9126066540385188
RISE & GRIND GORGEOUS!!!,kim,0.9967654426329862
Penelope's shoe closet http://instagr.am/p/QbDsSpOS_0/?,kim,0.5108797969618507
I just cleaned out my closet and took out tons of fab stuff I will be posting on Ebay soon!,kim,0.8611980305531713
Kourtney & Kim Take New York starts now on E! East coast are you ready!!!!,kim,0.5123918384084746
"Oh. btw, make sure you friend me on facebook!!!! http://bit.ly/8pXrl",kim,0.678191452617062
"My sisters and I will be at Sears Yonkers Fri, Sept 14 at 4pm- inside Cross County Shopping Center. More details here: http://bit.ly/QzDjyf?",kim,0.9754910282007074
This is what my little valentine gave me! VDay Mason style pic.twitter.com/xUJBJHDb,kim,0.65007222062928
Praying for victims of the earthquake in Nepal. Pls. help @prabalgurung raise relief money by donating herehttp://fw.to/Yyd30Ga?,kim,0.8527608226681617
So excited about our gorgeous new line of #KardashianKollection Home bedding. We're giving away a set: http://on.fb.me/HDVd18? Good luck!,kim,0.6026263885608467
Loving all of your makeup inspiration from Instagram? http://bit.ly/1gFpyH1w?,kim,0.7008943700092171
"ANYTHING is possible! RT @TheDailyLove Forget what you've been told, anything is possible, no matter how big the goal!",kim,0.9960191815798961
"Morning everyone, I slept in... sorry Khloe u couldn't! About to get ready for the derby!",kim,0.6769419432634655
We wanna shoot a new fam music video...what song should we do it to?,kim,0.7504371718272641
Enjoying Greece with @brodyjenner @kourtneykardash @krisjenner http://instagram.com/p/Yp17krOS73/?,kim,0.7630197414484695
Introducing our new Kardashian Kollection Eyewear line! http://bit.ly/NfQMsN? What do u guys think?,kim,0.8902735479922923
WOW RT @limesandsmiles: @KimKardashian FUNFACT U have the same amount of twitterfollowers as people in Holland! U have ur own little country,kim,0.9672545807909254
Me & @roxandstohler at my Esquire shoot! Love you Char!!! http://instagr.am/p/LVsB92OS17/?,kim,0.5320511767571879
Because I couldn't wait until Oct... http://bit.ly/bPKpic? #ellenvonunwerthpic.twitter.com/xzDfOkKmJU,kim,0.7394443740999045
"So true! RT @NICKIMINAJ RT @ihatequotes: True confidence leaves no room for jealousy. When u KNOW u are great, u have no need to hate!",kim,0.5479182439064887
Off to Dubai now thanks to Emirates Hospitality http://Sheeraz.com? @Atlantis @TheDubaiMall  See you all at Millions of Milkshakes xoxo,kim,0.5762745196652602
Nothing better in life! http://twitpic.com/21szda,kim,0.5495096138737604
morningpic.twitter.com/a2hBqy6NK7,kim,0.6214581026688718
"So cute! RT @KrisJenner: Reading Justin Bieber's new book ""Just Getting Started"" & look what I found! LOL  http://instagr.am/p/QR3UszG-MD/?",kim,0.8076953081726025
Kourtney & Kim Take New York is on East Coast! This is a good episode! @KhloeKardashian & I finally resolve our issues.I love my sissy,kim,0.9907091906511212
"Red lips, side parts and stunning dresses! http://bit.ly/jkfha668?",kim,0.7605455647453451
Will Smith gets the crowd going!!!! http://www.keek.com/!Enfhbab?,kim,0.6939631480315268
Yummy! My kinda football day RT @CarlaDiBello: Football Sundaes! http://lockerz.com/s/141975532?,kim,0.9421750136534124
Omg I'm so sorry! Its the ugliest crying face ever! LOL RT @atothebed: I think @KimKardashian and I have the same crying face.,kim,0.9616909488372998
"Today's look- And Re Walker dress, Alaia heels #HamptonsStyle http://instagram.com/p/qA9vm0uS9r/?",kim,0.9617870126072678
I can't wake up today!,kim,0.7504558864725915
No drinks this trip RT @JonathanCheban On my way to NOBU to meet @kimkardashian and Reggie for some strawberry sake!! I love miami!!,kim,0.9968911436797228
I'm making my favorite snack...rice crispie treats! Perfect Saturday!,kim,0.6720718379524997
"Is anyone as excited as I am for Mariah Carey's Christmas Album? I'm playing her old one now. A little early I know, just makes me so happy!",kim,0.7519323719323574
Family photo shoot today! Nothing better than spending the day with the whole family!,kim,0.7339037486167792
"I tweeted that already! LOL RT @KhloeKardashian: ""Be right or get left"" LOL I can't... Hahahahhahahahaha",kim,0.9474198076643162
Filming with Kathy Griffin today for AList Awards!,kim,0.5550056786369285
Heat/Knicks game with my Fam @lorenridinger & @Jrridinger http://instagr.am/p/S7ADrhuS0P/?,kim,0.9528224446505709
Who's ready to take New York with me??? Let's live tweet! KKTNY is starting soon! Turn on E!,kim,0.6272243469116754
We are twitter bff's! RT @kattyholmesx: Wish I was bestfriends with @kimkardashian ox,kim,0.5330459479909709
RT @ihatequotes All life tests are just preparation for something bigger in the future. Stay strong and have faith!,kim,0.5010890285452246
"Tonight at NBC Universal Upfronts. Wearing Wes Gordon, Bronzy glam by meredithbaraf Sleek hair by? http://instagram.com/p/oDJvwAOSy9/?",kim,0.7727116296557462
Another special announcement!! http://bit.ly/cTvEI1 #Kardash90210,kim,0.9232770000886632
Didn't u love this movie?!? I'm obsessed! RT @MsLaurenLondon: Watched Katy Perry movie on the plane. Love her!!!,kim,0.6322439684331999
I like our one hour special's better! This half hour show seems so short! #kardashians,kim,0.5065687230809929
"Everyone go pick up a copy of @KanyeWest 's new album ""My Beautiful Dark Twisted Fantasy""    in stores now! Its crazy!!!",kim,0.8406601113290979
"I had a very long but productive day...so ready to pass out, but my room is a mess from packing & I can't fall asleep w a messy room :-(",kim,0.8237448397404911
Dressing Diary ? Black Pantsuit? http://bit.ly/SkEExt1?,kim,0.9050942539498336
"Wow, check out TiVo Premiere! Has Netflix, YouTube & Pandora and now it?s only $99 at Best Buy. You can't beat it! http://bit.ly/flgA7j #ad",kim,0.6173894965555199
Wake up and smell the roses #morningwalkspic.twitter.com/nkMBNUnW0d,kim,0.9566258364154472
Breakfast on the balcony! Life couldn't get any better! Goooood morning world! http://twitpic.com/2pj61d,kim,0.7754365967033019
Late night fitting #pucci http://instagr.am/p/O5n-2gOS47/?,kim,0.7832221018917607
"Wow what a game, so intense!!! Ok changing the channel to E! Season finale part 1 starts now east coast!",kim,0.9518849888447862
A few months ago this woman was on my flight #KrisJennerMuch?!?!?!pic.twitter.com/fh6YjNFl8o,kim,0.8468546530656661
Tweet dreams! Say your prayers!,kim,0.524625771205896
four in the mornin' and he's zonin' @mxmtttpic.twitter.com/2toTjHRrUE,kim,0.9745655080704242
11:11 make a wish!,kim,0.8004354379335963
Getting ready to go to the Saints game! Let's go New Orleans! Who dat!!!!,kim,0.6917889678487573
"Check out @KardashianGirls  She makes the best collages
http://www.twitpic.com/photos/KardashianGirls",kim,0.8149803231330328
What size shoe are you?,kim,0.9874285035538244
Let's go Lakers!!! At the game with @KhloeKardashian,kim,0.946384138734202
Did u guys watch Kourtney & Khloe Take Miami tonight? What did u think?,kim,0.8390590228407038
Watching Extreme Cougar Wives... OMGGGG,kim,0.8703776750161591
Kanye West ? Bound2 (UNCENSORED) http://bit.ly/1aE0Ysdfe?,kim,0.7331496050321846
Wait u didn't think I would forget about National Selfie Day! DUHpic.twitter.com/fL7O62kyxX,kim,0.5670923866338358
RT @RobKardashian http://twitpic.com/816af - This is the sign my Dad sent @KhloeKardashian today when she got money from the atm! How crazy!,kim,0.5783116422663253
Taptuvats??? U speak Armenian Rox? RT @RoxySowlaty Getting a carwash at handy j's-my car was a dirty taptuvats messsssssss,kim,0.9191784866089532
"KKTM time, east coast!! Turn on E! now!",kim,0.7293059105084642
Happy Birthday to my husband and best friend in the entire world! You have changed my life in more? http://instagram.com/p/o_GjTauS8v/?,kim,0.8096536911270458
Isn't it weird how singers like Rihanna & Celine Dion sing in an American accent but really speak w an accent,kim,0.6622029986747203
Repost! @carladibello this ones for you!!!! http://instagram.com/p/ZtzXeouSxu/?,kim,0.9740614811881184
Not todaypic.twitter.com/mxbVAGhCyH,kim,0.6807497615913207
Did u guys know MEDIA KING Perez Hilton has a fab new website? www.cocoperez.com I LOVE IT!,kim,0.8443039477540463
I?m starring in the @SKECHERSUSA Super Bowl ad! See a sneak peek here! http://bit.ly/g8byjg,kim,0.7174812965423134
I'm craving Top Ramen noodles!!!,kim,0.7143949727346159
I love u @KourtneyKardash buuuut @KhloeKardashian is the most supportive sister! I LOVE YOU BOTH!,kim,0.6235907109886581
Favorite singers of all time are Celine Dion and Beyonce! I love Andrea Bocelli too!,kim,0.8564491901928724
Look at Kourt! RT @KourtneyKardash Check me out on the corner cover of people mag http://bit.ly/12UUF3,kim,0.6868884228281396
Everyone google Troy Davis & read his story! NO ONE should die by lethal injection when there is this much doubt! Help save #TroyDavis,kim,0.8477582042470052
My baby sister @KendallJenner is almost at a MILLION followers!!!! Everyone please follow her and RT! Let's get her there!,kim,0.7823039389030914
Happy Thanksgiving twitterfam! Let the cooking begin! I'm starting with my seet potatoe souffle! yummy!,kim,0.911815616844006
Happy Birthday to my stepdad Bruce! Wow 60 years old!!!! I love u so much!!!!!,kim,0.9325050121763752
Family pow wow with @khloekardashian @reallamarodom http://instagr.am/p/O3CQ3tuSxi/?,kim,0.7487149234940046
Morning hike last week in St. Barth's with my mammapic.twitter.com/LwYFRgIT9X,kim,0.7450090915244739
"RT @JasonBinn When we say the word love, it is not about who you can see yourself with. Love is about who you can't see yourself without.",kim,0.9963622706195986
Theo Wenner @theo123456 gave me no direction & just wanted to capture me being me! @VogueSpain #KimNoFilterpic.twitter.com/4VEPqh55nW,kim,0.9343921395929164
Happy Mothers Day to my grandma MJ. U've taught all of us girls to be independent & work hard. I'm so grateful for upic.twitter.com/HUjVkmiqax,kim,0.8049329234447724
Girls night out with ashkassan bunnyzwr @simoneharouche http://instagr.am/p/UDLwRaOS48/?,kim,0.8544108063296493
"Everyone please go to people.com and vote for my boyfriend REGGIE BUSH! http://www.people.com/people/celebrities/0,,,00.html",kim,0.8297926377514667
GOATpic.twitter.com/sj5KlIr0Ue,kim,0.6754152198505585
Bonjour Baby  http://instagram.com/p/ezzMVQOSyX/?,kim,0.6141085025135403
"Part 2 Keeping Up With The Kardashians is on tonight! Last week was intense, been waiting for tonight to redeem myself! Just wait & see!",kim,0.676875261297455
"Even when I can sleep in, my body just wakes up! So annoying.",kim,0.5933633904777683
Kendall's music video debut!!!! http://bit.ly/cYJAoD I'm such a proud big sis!,kim,0.9122580988005718
"Some woman at this hotel just came up 2 me  said...""U look so much better alive"" What is that supposed 2 mean?",kim,0.7077903438062182
Don?t forget to tune in for an all new #KUWTK tonight on E!,kim,0.7275670002810741
"Someone stole @BrodyJenner's phone, that tweet about Adrina was not him!",kim,0.8790534756717729
You guys!!! @TEYANATAYLOR has the best body ever!!! Like no joke and just had a baby!!!! ,kim,0.6527071641792244
Thank you womensweardaily for featuring @kbeautyhair on your cover! I can't wait until the product? http://instagram.com/p/sS4YbyuSyx/?,kim,0.8438562583453509
REAL FRIENDSpic.twitter.com/7nBNPCX6Sy,kim,0.7731245151369499
Sal must've been jumping up like me! Lol RT @MonicaRoseStyle He made Sal a happy man! RT @KimKardashian: My baby @Reggie_Bush is on fire!!!,kim,0.8865748931347793
Count your blessings. Develop an attitude of gratitude ,kim,0.9545594008391992
Loved this look #DateNight http://instagram.com/p/hKLkfkOS-j/?,kim,0.8668908003032544
"@FP30 I don't know, my feet do hurt a lot! It does take getting used to!",kim,0.9580791898236096
You think you know but sometimes you just don't #IHateBullying #MeanCommentsIsBullyingToo http://instagram.com/p/uV2jsuuSx-/?,kim,0.7564914034302247
"Only 3 days left to enter my contest, Queen of the Kims! See first 2 finalists here: http://bit.ly/32Hpq and enter here: http://bit.ly/qtENQ",kim,0.6734260909327141
Peplum perfection! http://bit.ly/LVfmSW? Love this! @Maytedoll,kim,0.8064286399952936
Its SHOWTIME baby!!!,kim,0.9420923201099892
Who's watching Keeping Up With The Kardashians?!? Love this episode. U guys will love mine & kokes plan to help @RobKardashian lol,kim,0.8862144703794845
Oh how things have changed....tune into E tonight and see for yourself! #KUWTK #Season9 http://instagram.com/p/jXe-3vuSxZ/?,kim,0.5107932590035961
Awwwwwwww I'm so excited right now!!!!! He looks so cute!!,kim,0.5994322089083955
I love gaghant babba!! ??Shnoravor surpt dznunt my fellow armos!,kim,0.5566467178381848
Found this pic while unpacking! It's from 2006 in Ibiza. Happy belated birthday @ParisHiltonpic.twitter.com/Jvz1aBoBGo,kim,0.5836357322795244
Happy Birthday Daddypic.twitter.com/diQvqintxo,kim,0.587808695764519
RT @JasonBinn: In life don't ever stop doing what you love & are passionate about,kim,0.8210195353959577
"#BritishGQ Styled by Carlyne Cerf De Dudzeele, Hair by Serge Normant, MakeUp by Jeanine Lobell http://instagram.com/p/te9o0puS_T/?",kim,0.6229049184280167
Rise & Grind! Fighting through the sleepiness! Long work day ahead! Hope you all have a great day!xoxo,kim,0.8823739507067567
So amazing to see our Kardashian Kollection on the runway! http://bit.ly/omyI4n?,kim,0.6160081143127839
So many funny moments! http://bit.ly/aFIRy8 @keepinupwkris It's gonna be one crazzzyy 5th season!!,kim,0.6830482027889269
Good morning San Francisco http://instagram.com/p/rfOFt5uSxW/?,kim,0.7017734532040593
Best food in France! http://bit.ly/13WtFdw2?,kim,0.9018935653591618
Gaga is singing Telephone!  I'm kinda busy!,kim,0.983521022298496
"@spencerpratt He's at the gym now, u should go meet him! Lets all work out together",kim,0.9270745983064131
long day...glad to sleep in my bed...Emmy's tomorrow!,kim,0.8345379672594423
http://bit.ly/cvegdJ How gorgeous is my little Mason?,kim,0.7694071966538971
"Me too!  ? RT @KourtneyKardash
I miss Miami now! #KKTM",kim,0.7853481455607783
Just got a call from my mom telling me about this prank call that someone was shot in their home & 15 swat team & 3 helicopters showed up!,kim,0.842281114409585
"I did the best make up tutorial for my app w none other than @ctilburymakeup We did her classic ""rock chick"" look!pic.twitter.com/8GfXQLl9Yb",kim,0.6528921039470772
Christmas isn't over! Still time to shop! LOL http://tiny.cc/JNsjM,kim,0.5216256061486354
Seriously @JonathanCheban LIP INJECTIONS??? Soooo rude!,kim,0.9272894894765472
So fun being in my girl @fergie's video for Milf Money! Everyone go watch it! pic.twitter.com/Ig2mpbnJog,kim,0.8419625919911802
I second that! RT @CarlaDiBello I think every bad song could be tolerable if Lil Wayne had a verse on it...,kim,0.8682967908325391
I remember Kanye came to watch that shoot ! ,kim,0.8745797529959407
Can't wait to go see Temptation tonight!!! Who is going to see it??? Please tweet me & tell me what u think,kim,0.9893222866781712
PINK IN PARIS http://bit.ly/1MS1AZL?pic.twitter.com/uWIV69qttv,kim,0.5077133365034551
Heading to @KhloeKardashian @RealLamarOdom 's party! Wooowhooo!!!!,kim,0.6587267384262043
I am honestly so proud of my brother @RobKardashian for his new OP ad campaign! Get it Robbie!!! love you,kim,0.9166863737684048
Kimoji update is here! A whole new vibe! Android and iOS! http://g.co/play/kimoji?   http://appstore.com/kimoji?pic.twitter.com/zGvPKohF5n,kim,0.7992179038890872
"I think I saw some Australia tour dates floating around so if it's all still the same, this year for sure!https://twitter.com/monkardashian/status/742626096751857664??",kim,0.9861045505320378
"Airport vibes- Vetements sweatshirt, J Brand jeans, Tom Ford Bootspic.twitter.com/ylXJYP12gU",kim,0.9929530960834788
Kylie is at it again!! http://bit.ly/vhgjlp?,kim,0.7165257948970778
"Dolls, come see me at Macy's Glendale on Feb 22 at 6pm! I'll be meeting and greeting the first 300 customers to buy my fragrance package! Xo",kim,0.7958825380727871
just saw baby monkey's running around! We are gonna go feed them!!!!! They said they are friendly!,kim,0.7427675757277666
#HairfinityResults - The pic on the left was me 7 months ago and the pic on the right is me now? http://instagram.com/p/uZe_h2uS8f/?,kim,0.8911619275491336
Sunday organizing the closet #SoManyYearsOfDesigning #CantWaitForAdidas http://instagram.com/p/l6YZkzOS-q/?,kim,0.6481489162004648
Need a Body Factory Shake NOW! Saw @TristaSutter at the gym!,kim,0.7184488264405757
Thank U! Luv u RT @CONY_STAR: KIM!  Look what I made for YOU! http://twitpic.com/8o305i? & http://twitpic.com/9gilz4? I Love You So Much! Besitos!Muah,kim,0.8333272549332622
Really though? #SideEyepic.twitter.com/IZIRYA90Bp,kim,0.7256360082447021
I feel so blessed to have the best family and friends ever! Friendship and family is what real life is all about! Its all u need in life!,kim,0.9313295003753048
"Just added new items to my eBay auctions!! http://bit.ly/WkSLPk? Alexander McQueen, Stella McCartney, Alaia and lots more!",kim,0.6041159945779683
I'm sooo excited to go see my brother at Dancing With The Stars tonight! He's dancing 1st & I heard its a special dance tonight! Can't wait!,kim,0.6497309903586808
Happy Sunday! Hope everyone has a relaxing day!,kim,0.9894482982363796
Have fun tonight @khloekardashian at the Kardashian Kollection launch party at the Natural History Museum in London! ,kim,0.9217929284008424
Today's theme is Rob because it's his bday and these old funny videos Khloe is sending has me crying they are so funny!,kim,0.5850231826094024
We?re halfway there! Keep tweeting using #KKTM to unlock the first 10 mins of@KandKTake before the premiere on Sunday! http://on.fb.me/UVBKQ3?,kim,0.9315372264504336
Rob K is trending!!!!!,kim,0.5419529143648157
BTS pic at our Kardashian Kollection shoot #Henrypic.twitter.com/oSa51X139U,kim,0.5916224861365793
Hey guys listen to me on what Blog Talk Radio live http://tinyurl.com/KardashianBTR,kim,0.5709919595245004
Omg the talk!!!,kim,0.7137853094566198
Beach selfies of course! pic.twitter.com/MqneRUVK7t,kim,0.6996783709550134
HOW TO CLAP BACK WITH JONATHAN CHEBAN http://bit.ly/2aGEtbd?pic.twitter.com/494QuPl8Kq,kim,0.7149786950714855
What's wrong with my twitter? LOL who's watching OWN right now?,kim,0.8844003448084999
Congrats to my girl @serenawilliams on making history!!!!! Truly the GOAT! Thank you for inspiring the world! ,kim,0.6356538509834603
Football Sunday!!! Who do u guys got today? My guess is 49ers & the Patriots!,kim,0.9144375509488748
I just downloaded it. I really love this song toohttps://twitter.com/kanyewest/status/754171721247105024??,kim,0.8055481590327777
Hey @TheRealDJClue I am #TeamStraightHair http://twitpic.com/3ngemi,kim,0.9194581399063896
Thanks for the love @Cosmopolitan! You picked some of my favorites too?  http://bit.ly/1gRvezo11?,kim,0.7635034641559854
Teen Choice Awards look- Balmain top & skirt. Balenciaga heels http://instagram.com/p/rie1P4OS8Y/?,kim,0.9958062359248964
I am so loving @NickiMinaj I love her voice  her attitude!!!!,kim,0.5066781690320905
Love Masey! RT @WannaBeLikeKim: RT @KimberlyKFans: @Kimkardashian Hey Kimmie! Look what I made you! KiKi & Mason <3 http://twitpic.com/a50s7g?,kim,0.5294288173353766
Anyone watching Nascar? U guys see the pink Kim Kardashian car?,kim,0.5596461105826657
Needing a Cuban coffee run soon! #addicted,kim,0.9762991821603804
"RT & help @RED raise $100,000 for an AIDS FREE GENERATION! @JNJCares gives $1 per share! #shareREDpic.twitter.com/9GHjq2XBfO",kim,0.5712875835577567
I soooo didn't mean to lie to you guys about GOOD FRIDAYS coming back. Kanye flew to Italy for a Yezzy Season 3 fitting.,kim,0.7170338188351099
Just touched down in Vegas! Going to Pink's Hot Dogs! YUM! Wow Cupcake's & Hot Dog's in one day!,kim,0.6362543020162605
Everyone go for Kanye to win #VideooftheYear for FAMOUS at the #VMAs http://mtv.com/vma/vote/video??,kim,0.8036597402942538
New #KUWTK preview! http://bit.ly/1xdlBTv1?,kim,0.8608044129543413
RUNWAY TO REAL WAY: GIVENCHYhttp://bit.ly/29geSTP?,kim,0.9866965518018366
Valentino show was simply beautiful!,kim,0.8855306531060303
